"Name","Internal name","Type","Description","Group name","Form field","Options","Read only value","Read only definition","Calculated","External options","Deleted","HubSpot defined","Created user","Usages","Fill rate","Last Updated Time","Update Source"
"Record source detail 3","hs_object_source_detail_3","string","Third level of detail on how this record was created.","contactinformation","false","","true","true","false","false","false","true","HubSpot","","0%","",""
"Record source","hs_object_source_label","enumeration","How this record was created.","contactinformation","false","","true","true","false","true","false","true","HubSpot","","100%","2/19/26 2:38 PM EST","CRM UI"
"Persona","hs_persona","enumeration","A contact's persona","contactinformation","true","","false","true","false","false","false","true","HubSpot","","0%","",""
"Prospecting Agent Last Enrolled","hs_prospecting_agent_last_enrolled","datetime","The last time the Prospecting Agent enrolled this contact","contactinformation","false","","false","true","false","false","false","true","HubSpot","","0%","",""
"Prospecting Agent Total Enrolled Count","hs_prospecting_agent_total_enrolled_count","number","","contactinformation","false","","false","true","false","false","false","true","HubSpot","","100%","2/19/26 2:38 PM EST","HubSpot Calculation"
"Registration Method","hs_registration_method","string","The method used for registration","contactinformation","false","","true","true","false","false","false","true","HubSpot","","0%","",""
"Employment Role","hs_role","enumeration","Job role","contactinformation","true","Accounting (accounting); Administrative (administrative); Business Development (business_development); Communications (communications); Consulting (consulting); Customer Service (customer_service); Design (design); Education (education); Engineering (engineering); Entrepreneurship (entrepreneurship); Finance (finance); Health Professional (health_professional); Human Resources (human_resources); Information Technology (information_technology); Legal (legal); Marketing (marketing); Operations (operations); Product (product); Project Management (project_management); Public Relations (public_relations); Quality Assurance (quality_assurance); Real Estate (real_estate); Recruiting (recruiting); Research (research); Sales (sales); Support (support); Retired (retired)","false","false","false","false","false","true","HubSpot","","0%","",""
"Recent Sales Email Clicked Date","hs_sales_email_last_clicked","datetime","The last time a tracked sales email was clicked by this user","contactinformation","false","","true","true","false","false","false","true","HubSpot","","0.84%","1/12/26 3:25 PM EST","HubSpot Calculation"
"Recent Sales Email Opened Date","hs_sales_email_last_opened","datetime","The last time a tracked sales email was opened by this contact. This property does not update for emails that were sent to more than one contact.","contactinformation","false","","true","true","false","false","false","true","HubSpot","","20.45%","2/19/26 9:16 AM EST","HubSpot Calculation"
"Recent Sales Email Replied Date","hs_sales_email_last_replied","datetime","The most recent email from this contact that was received and logged by HubSpot. This value is automatically set by HubSpot and may not be modified.","contactinformation","false","","true","true","false","false","false","true","HubSpot","","35.35%","2/19/26 7:17 AM EST","HubSpot Calculation"
"Employment Seniority","hs_seniority","enumeration","Job Seniority","contactinformation","true","VP (vp); Director (director); Entry (entry); Executive (executive); Manager (manager); Owner (owner); Partner (partner); Senior (senior); Employee (employee)","false","false","false","false","false","true","HubSpot","","0%","",""
"Number of sequences enrolled","hs_sequences_enrolled_count","number","The number of sequences enrolled.","contactinformation","false","","true","true","false","false","false","true","HubSpot","","0%","",""
"Currently in Sequence","hs_sequences_is_enrolled","bool","A yes/no field that indicates whether the contact is currently in a Sequence.","contactinformation","false","True (true); False (false)","true","true","true","false","false","true","HubSpot","","0%","",""
"Shared teams","hs_shared_team_ids","enumeration","Additional teams whose users can access the Contact based on their permissions. This can be set manually or through Workflows or APIs.","contactinformation","false","","false","true","false","true","false","true","HubSpot","","0%","",""
"Shared users","hs_shared_user_ids","enumeration","Additional users that can access the Contact based on their permissions. This can be set manually or through Workflows and APIs.","contactinformation","false","","false","true","false","true","false","true","HubSpot","","0%","",""
"State/Region Code","hs_state_code","string","The contact's state or region code.","contactinformation","true","","false","false","false","false","false","true","HubSpot","","0%","",""
"Employment Sub Role","hs_sub_role","enumeration","Job sub role","contactinformation","true","Account Executive (account_executive); Account Manager (account_manager); Accountant (accountant); Accounting Manager (accounting_manager); Administrative Assistant (administrative_assistant); Appraisal (appraisal); Architect IT (architect_it); Assistant (assistant); Attorney (attorney); Auditor (auditor); Brand Marketing (brand_marketing); Business Analyst (business_analyst); Business Consultant (business_consultant); Business Manager (business_manager); Chief Financial Officer (chief_financial_officer); Communications Manager (communications_manager); Community (community); Content Marketing (content_marketing); Contracts (contracts); Creative (creative); Customer Service Specialist (customer_service_specialist); Customer Success (customer_success); Data IT (data_it); Data Science Engineer (data_science_engineer); Database Administrator (database_administrator); Design Engineer (design_engineer); Development Specialist (development_specialist); Devops Engineer (devops_engineer); Digital Marketing (digital_marketing); Director of Development (director_of_development); Editorial (editorial); Electrical Engineer (electrical_engineer); Engineering Manager (engineering_manager); Events (events); Executive Assistant (executive_assistant); Facilities (facilities); Fashion Design (fashion_design); Field Marketing (field_marketing); Financial Analyst (financial_analyst); Financial Controller (financial_controller); Fitness (fitness); Founder (founder); General Counsel (general_counsel); General Manager (general_manager); General Partner (general_partner); Graphic Design (graphic_design); Human Resources Specialist (human_resources_specialist); Information Technology Specialist (information_technology_specialist); Investment (investment); Investment Banker (investment_banker); Journalist (journalist); Key Account Manager (key_account_manager); Law Enforcement (law_enforcement); Lawyer (lawyer); Logistics Manager (logistics_manager); Management (management); Marketing Specialist (marketing_specialist); Mechanical Engineer (mechanical_engineer); Medical Doctor (medical_doctor); Network Engineer (network_engineer); Nurse (nurse); Office Management (office_management); Office Manager (office_manager); Operational Specialist (operational_specialist); Owner (owner); Paralegal (paralegal); Principal (principal); Product Design (product_design); Product Manager (product_manager); Product Marketing (product_marketing); Production Manager (production_manager); Professor (professor); Program Coordinator (program_coordinator); Program Manager (program_manager); Project Engineer (project_engineer); Project Manager (project_manager); Property Manager (property_manager); QA engineer (qa_engineer); QA IT (qa_it); Quality Assurance Manager (quality_assurance_manager); Quality Assurance Specialist (quality_assurance_specialist); Realtor (realtor); Recruiter (recruiter); Relationship Manager (relationship_manager); Research Analyst (research_analyst); Risk Compliance (risk_compliance); Sales Executive (sales_executive); Sales Operations (sales_operations); Sales Specialist (sales_specialist); Salesperson (salesperson); Secretary (secretary); Social Marketing (social_marketing); Software Engineer (software_engineer); Strategy (strategy); Student (student); Support (support); Support Specialist (support_specialist); System Administrator (system_administrator); System Analyst (system_analyst); Systems Engineer (systems_engineer); Talent (talent); Tax Audit (tax_audit); Teacher (teacher); Technical Manager (technical_manager); Technical Support Specialist (technical_support_specialist); Therapist (therapist); Training (training); Video (video); Web Developer (web_developer); Writer (writer); Chief Executive Officer (chief_executive_officer); Chief Operating Officer (chief_operating_officer); Chief Marketing Officer (chief_marketing_officer); Chief Technology Officer (chief_technology_officer); Chief Information Officer (chief_information_officer); Chief Human Resources officer (chief_human_resources_officer); Chief Compliance Officer (chief_compliance_officer); Chief Risk Officer (chief_risk_officer); Chief Data Officer (chief_data_officer); Chief Product Officer (chief_product_officer); Chief Revenue Officer (chief_revenue_officer); Chief Sustainability Officer (chief_sustainability_officer); Chief Legal Officer (chief_legal_officer); Chief Security Officer (chief_security_officer); Chief Experience Officer (chief_experience_officer); Chief Innovation Officer (chief_innovation_officer); Retail (retail); Retired (retired)","false","false","false","false","false","true","HubSpot","","0%","",""
"Time between contact creation and deal close","hs_time_between_contact_creation_and_deal_close","number","","contactinformation","false","","false","false","false","false","false","true","HubSpot","","61.46%","2/19/26 1:05 PM EST","HubSpot Calculation"
"Time between contact creation and deal creation","hs_time_between_contact_creation_and_deal_creation","number","","contactinformation","false","","false","false","false","false","false","true","HubSpot","","6.69%","2/19/26 2:38 PM EST","HubSpot Calculation"
"Time to move from lead to customer","hs_time_to_move_from_lead_to_customer","number"," How long it takes for a contact to move from the HubSpot lead stage to the HubSpot customer stage.","contactinformation","false","","false","false","false","false","false","true","HubSpot","","32.25%","2/19/26 1:05 PM EST","HubSpot Calculation"
"Time to move from marketing qualified lead to customer","hs_time_to_move_from_marketingqualifiedlead_to_customer","number"," How long it takes for a contact to move from the HubSpot marketing qualified lead stage to the HubSpot customer stage.","contactinformation","false","","false","false","false","false","false","true","HubSpot","","2.9%","2/19/26 1:04 PM EST","HubSpot Calculation"
"Time to move from opportunity to customer","hs_time_to_move_from_opportunity_to_customer","number"," How long it takes for a contact to move from the HubSpot opportunity stage to the HubSpot customer stage.","contactinformation","false","","false","false","false","false","false","true","HubSpot","","7.77%","2/19/26 1:05 PM EST","HubSpot Calculation"
"Time to move from sales qualified lead to customer","hs_time_to_move_from_salesqualifiedlead_to_customer","number"," How long it takes for a contact to move from the HubSpot sales qualified lead stage to the HubSpot customer stage.","contactinformation","false","","false","false","false","false","false","true","HubSpot","","0.64%","2/19/26 1:04 PM EST","HubSpot Calculation"
"Time to move from subscriber to customer","hs_time_to_move_from_subscriber_to_customer","number"," How long it takes for a contact to move from the HubSpot subscriber stage to the HubSpot customer stage.","contactinformation","false","","false","false","false","false","false","true","HubSpot","","1.18%","2/19/26 1:04 PM EST","HubSpot Calculation"
