"Name","Internal name","Type","Description","Group name","Form field","Options","Read only value","Read only definition","Calculated","External options","Deleted","HubSpot defined","Created user","Usages","Fill rate","Last Updated Time","Update Source"
"Last used Aircall tags","last_used_aircall_tags","string","Aircall tags on last Aircall call activity","aircall","false","","false","false","false","false","false","false","Lucas Graham","","0%","",""
"Average Pageviews","hs_analytics_average_page_views","number","The average number of pages a contact sees. This is automatically set by HubSpot for each contact.","analyticsinformation","false","","true","true","false","false","false","true","HubSpot","","100%","2/19/26 2:38 PM EST","Analytics"
"First Referring Site","hs_analytics_first_referrer","string","The first website that referred a contact to your website. This is automatically set by HubSpot for each contact.","analyticsinformation","false","","true","true","false","false","false","true","HubSpot","","0%","2/19/26 1:04 PM EST","Analytics"
"Time First Seen","hs_analytics_first_timestamp","datetime","The first time a contact has been seen. This is automatically set by HubSpot for each contact.","analyticsinformation","false","","true","true","false","false","false","true","HubSpot","","100%","2/19/26 2:38 PM EST","Analytics"
"First Touch Converting Campaign","hs_analytics_first_touch_converting_campaign","string","The campaign responsible for the first touch creation of this contact","analyticsinformation","false","","true","true","false","true","false","true","HubSpot","","0%","",""
"First Page Seen","hs_analytics_first_url","string","The first page a contact saw on your website. This is automatically set by HubSpot for each contact.","analyticsinformation","false","","true","true","false","false","false","true","HubSpot","","3.44%","2/16/26 4:54 PM EST","Analytics"
"Time of First Session","hs_analytics_first_visit_timestamp","datetime","The first time a contact visited your website. This is automatically set by HubSpot for each contact.","analyticsinformation","false","","true","true","false","false","false","true","HubSpot","","0%","2/19/26 1:09 PM EST","Analytics"
"Last Referring Site","hs_analytics_last_referrer","string","The last website that referred a contact to your website. This is automatically set by HubSpot for each contact.","analyticsinformation","false","","true","true","false","false","false","true","HubSpot","","0.84%","2/11/26 11:49 AM EST","Analytics"
"Time Last Seen","hs_analytics_last_timestamp","datetime","The last time and date a contact has viewed a page on your website.","analyticsinformation","false","","true","true","false","false","false","true","HubSpot","","0%","2/19/26 1:09 PM EST","Analytics"
"Last Touch Converting Campaign","hs_analytics_last_touch_converting_campaign","string","The campaign responsible for the last touch creation of this contact","analyticsinformation","false","","true","true","false","true","false","true","HubSpot","","0%","",""
"Last Page Seen","hs_analytics_last_url","string","The last page a contact saw on your website. This is automatically set by HubSpot for each contact.","analyticsinformation","false","","true","true","false","false","false","true","HubSpot","","3.44%","2/16/26 4:54 PM EST","Analytics"
"Time of Last Session","hs_analytics_last_visit_timestamp","datetime","The last time and date a contact visited your website.","analyticsinformation","false","","true","true","false","false","false","true","HubSpot","","0%","2/19/26 1:09 PM EST","Analytics"
"Number of event completions","hs_analytics_num_event_completions","number","The sum of all events a contact has experienced. This is automatically set by HubSpot for each contact.","analyticsinformation","false","","true","true","false","false","false","true","HubSpot","","100%","2/19/26 2:38 PM EST","Analytics"
"Number of Pageviews","hs_analytics_num_page_views","number","The sum of all pages a contact has seen on your website. This is automatically set by HubSpot for each contact.","analyticsinformation","false","","true","true","false","false","false","true","HubSpot","","100%","2/19/26 2:38 PM EST","Analytics"
"Number of Sessions","hs_analytics_num_visits","number","The sum of all sessions a contact has made to your website. This is automatically set by HubSpot for each contact.","analyticsinformation","false","","true","true","false","false","false","true","HubSpot","","100%","2/19/26 2:38 PM EST","Analytics"
"Event Revenue","hs_analytics_revenue","number","Event revenue can be set on a contact though HubSpot's enterprise Events. http://help.hubspot.com/articles/KCS_Article/Reports/How-do-I-create-Events-in-HubSpot","analyticsinformation","false","","true","true","false","false","false","true","HubSpot","","100%","2/19/26 2:38 PM EST","Analytics"
"Original Source","hs_analytics_source","enumeration","First known source the contact used to find your website. Set automatically, but may be updated manually.","analyticsinformation","false","Organic Search (ORGANIC_SEARCH); Paid Search (PAID_SEARCH); Email Marketing (EMAIL_MARKETING); Organic Social (SOCIAL_MEDIA); Referrals (REFERRALS); Other Campaigns (OTHER_CAMPAIGNS); Direct Traffic (DIRECT_TRAFFIC); Offline Sources (OFFLINE); Paid Social (PAID_SOCIAL); AI Referrals (AI_REFERRALS)","false","true","false","false","false","true","HubSpot","","100%","2/19/26 2:38 PM EST","Analytics"
"Original Source Drill-Down 1","hs_analytics_source_data_1","string","Additional information about the source through which a contact first found your website. This property is automatically set by HubSpot.","analyticsinformation","false","","true","true","false","false","false","true","HubSpot","","100%","2/19/26 2:38 PM EST","Analytics"
"Original Source Drill-Down 2","hs_analytics_source_data_2","string","Additional information about the source through which a contact first found your website. This property is automatically set by HubSpot.","analyticsinformation","false","","true","true","false","false","false","true","HubSpot","","100%","2/19/26 2:38 PM EST","Analytics"
"Latest Traffic Source","hs_latest_source","enumeration","The source of the latest session for a contact","analyticsinformation","false","Organic Search (ORGANIC_SEARCH); Paid Search (PAID_SEARCH); Email Marketing (EMAIL_MARKETING); Organic Social (SOCIAL_MEDIA); Referrals (REFERRALS); Other Campaigns (OTHER_CAMPAIGNS); Direct Traffic (DIRECT_TRAFFIC); Offline Sources (OFFLINE); Paid Social (PAID_SOCIAL); AI Referrals (AI_REFERRALS)","false","true","false","false","false","true","HubSpot","","100%","2/19/26 2:38 PM EST","Analytics"
"Latest Traffic Source Drill-Down 1","hs_latest_source_data_1","string","Additional information about the latest source for the last session the contact used to find your website. Set automatically.","analyticsinformation","false","","true","true","false","false","false","true","HubSpot","","100%","2/19/26 2:38 PM EST","Analytics"
"Latest Traffic Source Drill-Down 2","hs_latest_source_data_2","string","Additional information about the source for the last session the contact used to find your website. Set automatically.","analyticsinformation","false","","true","true","false","false","false","true","HubSpot","","100%","2/19/26 2:38 PM EST","Analytics"
"Latest Traffic Source Date","hs_latest_source_timestamp","datetime","The time of the latest session for a contact","analyticsinformation","false","","false","true","false","false","false","true","HubSpot","","100%","2/19/26 2:38 PM EST","Analytics"
"Street Address","address","string","A contact's street address, including apartment or unit #","contactinformation","true","","false","true","false","false","false","true","HubSpot","","10.96%","2/16/26 7:24 PM EST","HubSpot AI"
"Annual Revenue","annualrevenue","string","Annual company revenue","contactinformation","true","","false","false","false","false","false","true","HubSpot","","0.2%","",""
"Are you currently utilizing a Point-of-Sale system at your concept?","are_you_currently_utilizing_a_point_of_sale_system_at_your_concept_","enumeration","","contactinformation","true","Yes (true); No (false)","false","false","false","false","false","false","Lucas Graham","Rollup property (1)","0.25%","4/4/25 2:43 PM EDT","CRM UI"
"Are you looking for anything specific in your next point of sale provider?","are_you_looking_for_anything_specific_in_your_next_point_of_sale_provider_","string","","contactinformation","true","","false","false","false","false","false","false","Lucas Graham","Rollup property (1)","0%","",""
"Company Name","company","string","The name of the contact's company. This is separate from the Name property of the contact's associated company and can be set independently.","contactinformation","true","","false","true","false","false","false","true","HubSpot","Automation platform flow (1)","1.82%","",""
"Company size","company_size","string","A contact's company size. This property is required for the Facebook Ads Integration. This property will be automatically synced via the Lead Ads tool","contactinformation","true","","false","false","false","false","false","true","HubSpot","","0%","",""
"Contact Owner Closing Call Rebook Link","contact_owner_closing_call_rebook_link","string","","contactinformation","true","","false","false","false","false","false","false","Lucas Graham","","0.2%","7/23/25 12:59 PM EDT","Workflow"
"Contact Owner Demo Call Rebook Link","contact_owner_demo_call_rebook_link","string","","contactinformation","true","","false","false","false","false","false","false","Lucas Graham","","0.2%","7/23/25 12:59 PM EDT","Workflow"
"Contact Owner Discovery Call Rebook Link","contact_owner_discovery_call_rebook_link","string","","contactinformation","true","","false","false","false","false","false","false","Lucas Graham","","0.2%","7/23/25 12:59 PM EDT","Workflow"
"Contact Owner Follow-Up Call Rebook Link","contact_owner_follow_up_call_rebook_link","string","","contactinformation","true","","false","false","false","false","false","false","Lucas Graham","","0.2%","7/23/25 12:59 PM EDT","Workflow"
"Create Date","createdate","datetime","The date that a contact entered the system","contactinformation","false","","true","true","false","false","false","true","HubSpot","Rollup property (4); Inbounddb lists (1)","100%","2/19/26 2:38 PM EST","CRM UI"
"Date of birth","date_of_birth","string","A contact's date of birth. This property is required for the Facebook Ads Integration. This property will be automatically synced via the Lead Ads tool","contactinformation","true","","false","false","false","false","false","true","HubSpot","","0%","",""
"Days To Close","days_to_close","number","The days that elapsed from when a contact was created until they closed as a customer. This is set automatically by HubSpot and can be used for segmentation and reporting.","contactinformation","false","","true","true","true","false","false","true","HubSpot","","59.44%","2/19/26 1:05 PM EST","HubSpot Calculation"
"Degree","degree","string","A contact's degree. This property is required for the Facebook Ads Integration. This property will be automatically synced to via Lead Ads tool","contactinformation","true","","false","false","false","false","false","true","HubSpot","","0%","",""
"Email","email","string","A contact's email address","contactinformation","true","","false","true","false","false","false","true","HubSpot","Form (5); Automation platform flow (1); Flow action (2)","81.71%","2/19/26 2:38 PM EST","CRM UI"
"Date of last meeting booked in meetings tool","engagements_last_meeting_booked","datetime","The date of the last meeting that has been scheduled by a contact through the meetings tool. If multiple meetings have been scheduled, the date of the last chronological meeting in the timeline is shown.","contactinformation","false","","true","true","false","false","false","true","HubSpot","Inbounddb lists (1)","0.34%","",""
"Campaign of last booking in meetings tool","engagements_last_meeting_booked_campaign","string","This UTM parameter shows which marketing campaign (e.g. a specific email) referred the contact to the meetings tool for their most recent booking. This property is only populated when you add tracking parameters to your meeting link.","contactinformation","false","","true","true","false","false","false","true","HubSpot","","0%","",""
"Medium of last booking in meetings tool","engagements_last_meeting_booked_medium","string","This UTM parameter shows which channel (e.g. email) referred the contact to the meetings tool for their most recent booking. This property is only populated when you add tracking parameters to your meeting link.","contactinformation","false","","true","true","false","false","false","true","HubSpot","","0%","",""
"Source of last booking in meetings tool","engagements_last_meeting_booked_source","string","This UTM parameter shows which site (e.g. Twitter) referred the contact to the meetings tool for their most recent booking. This property is only populated when you add tracking parameters to your meeting link.","contactinformation","false","","true","true","false","false","false","true","HubSpot","","0%","",""
"Field of study","field_of_study","string","A contact's field of study. This property is required for the Facebook Ads Integration. This property will be automatically synced via the Lead Ads tool","contactinformation","true","","false","false","false","false","false","true","HubSpot","","0%","",""
"First Deal Created Date","first_deal_created_date","datetime","The date the first deal for a contact was created. This is automatically set by HubSpot and can be used for segmentation and reporting.","contactinformation","false","","true","true","false","false","false","true","HubSpot","","6.69%","2/19/26 2:38 PM EST","HubSpot Calculation"
"First Name","firstname","string","A contact's first name","contactinformation","true","","false","true","false","false","false","true","HubSpot","Form (4); Automation platform flow (4); Email (5)","80.58%","2/19/26 2:38 PM EST","CRM UI"
"Gender","gender","string","","contactinformation","true","","false","false","false","false","false","true","HubSpot","","0%","",""
"Gift Card Quantity","gift_card_quantity","number","","contactinformation","true","","false","false","false","false","false","false","Lucas Graham","","0%","",""
"Graduation date","graduation_date","string","A contact's graduation date. This property is required for the Facebook Ads Integration. This property will be automatically synced via the Lead Ads tool","contactinformation","true","","false","false","false","false","false","true","HubSpot","","0%","",""
"Handheld Guest Check Paper","handheld_guest_check_paper","number","","contactinformation","true","","false","false","false","false","false","false","Lucas Graham","Form (1)","0%","",""
"Buying Role","hs_buying_role","enumeration","The role that a contact plays during the sales process. Contacts can have more than one role, and they can share the same role with another contact.","contactinformation","true","Blocker (BLOCKER) [READ-ONLY]; Budget Holder (BUDGET_HOLDER) [READ-ONLY]; Champion (CHAMPION) [READ-ONLY]; Decision Maker (DECISION_MAKER) [READ-ONLY]; End User (END_USER) [READ-ONLY]; Executive Sponsor (EXECUTIVE_SPONSOR) [READ-ONLY]; Influencer (INFLUENCER) [READ-ONLY]; Legal & Compliance (LEGAL_AND_COMPLIANCE) [READ-ONLY]; Other (OTHER) [READ-ONLY]","false","true","false","false","false","true","HubSpot","Inbounddb lists (5)","0%","",""
"Enrichment opt out","hs_contact_enrichment_opt_out","bool","","contactinformation","false","Yes (true); No (false)","true","true","false","false","false","true","HubSpot","","0%","",""
"Enrichment opt out timestamp","hs_contact_enrichment_opt_out_timestamp","datetime","Timestamp of when the contact opted out of being included in the HubSpot Enrichment database","contactinformation","false","","true","true","false","false","false","true","HubSpot","","0%","",""
"Email Confirmed","hs_content_membership_email_confirmed","bool","Email Confirmation status of user of Content Membership","contactinformation","false","True (true); False (false)","true","true","false","false","false","true","HubSpot","","0%","",""
"Time enrolled in registration follow up emails","hs_content_membership_follow_up_enqueued_at","datetime","The time when the contact was first enrolled in the registration follow up email flow","contactinformation","false","","true","true","false","false","false","true","HubSpot","","0%","",""
"Membership Notes","hs_content_membership_notes","string","The notes relating to the contact's content membership.","contactinformation","false","","false","true","false","false","false","true","HubSpot","","0.44%","5/15/25 2:16 PM EDT","Mobile iOS"
"Status","hs_content_membership_status","enumeration","The status of the contact's content membership.","contactinformation","false","Active (active) [READ-ONLY]; Inactive (inactive) [READ-ONLY]","false","true","false","false","false","true","HubSpot","","0%","",""
"Country/Region Code","hs_country_region_code","string","The contact's two-letter country code.","contactinformation","true","","false","false","false","false","false","true","HubSpot","","0%","",""
"Currently Enrolled in Prospecting Agent","hs_currently_enrolled_in_prospecting_agent","bool","Indicates whether or not the contact has an active prospecting agent enrollment","contactinformation","false","Yes (true); No (false)","true","true","true","false","false","true","HubSpot","","100%","2/19/26 2:38 PM EST","HubSpot Calculation"
"Email Domain","hs_email_domain","string","A contact's email address domain","contactinformation","false","","true","true","true","false","false","true","HubSpot","Inbounddb lists (1); Automation platform flow (1)","81.71%","2/19/26 2:38 PM EST","HubSpot Calculation"
"Inferred Language Codes","hs_inferred_language_codes","enumeration","Inferred languages based on location.  ISO 639-1","contactinformation","false","Abkhazian (ab); Afar (aa); Afrikaans (af); Akan (ak); Albanian (sq); Amharic (am); Arabic (ar); Aragonese (an); Armenian (hy); Assamese (as); Avaric (av); Avestan (ae); Aymara (ay); Azerbaijani (az); Bambara (bm); Bashkir (ba); Basque (eu); Belarusian (be); Bengali (bn); Bislama (bi); Bokmål, Norwegian; Norwegian Bokmål (nb); Bosnian (bs); Breton (br); Bulgarian (bg); Burmese (my); Catalan; Valencian (ca); Central Khmer (km); Chamorro (ch); Chechen (ce); Chichewa; Chewa; Nyanja (ny); Chinese (zh); Church Slavic; Old Slavonic; Church Slavonic; Old Bulgarian; Old Church Slavonic (cu); Chuvash (cv); Cornish (kw); Corsican (co); Cree (cr); Croatian (hr); Czech (cs); Danish (da); Divehi; Dhivehi; Maldivian (dv); Dutch; Flemish (nl); Dzongkha (dz); English (en); Esperanto (eo); Estonian (et); Ewe (ee); Faroese (fo); Fijian (fj); Finnish (fi); French (fr); Fulah (ff); Gaelic; Scottish Gaelic (gd); Galician (gl); Ganda (lg); Georgian (ka); German (de); Greek, Modern (1453-) (el); Guarani (gn); Gujarati (gu); Haitian; Haitian Creole (ht); Hausa (ha); Hebrew (he); Herero (hz); Hindi (hi); Hiri Motu (ho); Hungarian (hu); Icelandic (is); Ido (io); Igbo (ig); Indonesian (id); Interlingua (International Auxiliary Language Association) (ia); Interlingue; Occidental (ie); Inuktitut (iu); Inupiaq (ik); Irish (ga); Italian (it); Japanese (ja); Javanese (jv); Kalaallisut; Greenlandic (kl); Kannada (kn); Kanuri (kr); Kashmiri (ks); Kazakh (kk); Kikuyu; Gikuyu (ki); Kinyarwanda (rw); Kirghiz; Kyrgyz (ky); Komi (kv); Kongo (kg); Korean (ko); Kuanyama; Kwanyama (kj); Kurdish (ku); Lao (lo); Latin (la); Latvian (lv); Limburgan; Limburger; Limburgish (li); Lingala (ln); Lithuanian (lt); Luba-Katanga (lu); Luxembourgish; Letzeburgesch (lb); Macedonian (mk); Malagasy (mg); Malay (macrolanguage) (ms); Malayalam (ml); Maltese (mt); Manx (gv); Maori (mi); Marathi (mr); Marshallese (mh); Mongolian (mn); Nauru (na); Navajo; Navaho (nv); Ndebele, North; North Ndebele (nd); Ndebele, South; South Ndebele (nr); Ndonga (ng); Nepali (macrolanguage) (ne); Northern Sami (se); Norwegian Nynorsk; Nynorsk, Norwegian (nn); Norwegian (no); Occitan (post 1500) (oc); Ojibwa (oj); Oriya (macrolanguage) (or); Oromo (om); Ossetian; Ossetic (os); Pali (pi); Panjabi; Punjabi (pa); Persian (fa); Polish (pl); Portuguese (pt); Pushto; Pashto (ps); Quechua (qu); Romanian; Moldavian; Moldovan (ro); Romansh (rm); Rundi (rn); Russian (ru); Samoan (sm); Sango (sg); Sanskrit (sa); Sardinian (sc); Serbian (sr); Shona (sn); Sichuan Yi; Nuosu (ii); Sindhi (sd); Sinhala; Sinhalese (si); Slovak (sk); Slovenian (sl); Somali (so); Sotho, Southern (st); Spanish; Castilian (es); Sundanese (su); Swahili (macrolanguage) (sw); Swati (ss); Swedish (sv); Tagalog (tl); Tahitian (ty); Tajik (tg); Tamil (ta); Tatar (tt); Telugu (te); Thai (th); Tibetan (bo); Tigrinya (ti); Tonga (Tonga Islands) (to); Tsonga (ts); Tswana (tn); Turkish (tr); Turkmen (tk); Twi (tw); Uighur; Uyghur (ug); Ukrainian (uk); Urdu (ur); Uzbek (uz); Venda (ve); Vietnamese (vi); Volapük (vo); Walloon (wa); Welsh (cy); Western Frisian (fy); Wolof (wo); Xhosa (xh); Yiddish (yi); Yoruba (yo); Zhuang; Chuang (za); Zulu (zu)","false","false","false","false","false","true","HubSpot","","0%","",""
"Intent Signals active","hs_intent_signals_enabled","bool","Indicates whether intent signal tracking is currently active for this record","contactinformation","false","Yes (true); No (false)","true","false","false","false","false","true","HubSpot","","0%","",""
"Has been enriched","hs_is_enriched","bool","Indicates whether this object has ever had enriched properties written to it.","contactinformation","false","Yes (true); No (false)","true","true","false","false","false","true","HubSpot","","0%","",""
"Contact unworked","hs_is_unworked","bool","Contact has not been assigned or has not been engaged after last owner assignment/re-assignment","contactinformation","false","True (true); False (false)","true","true","false","false","false","true","HubSpot","","100%","2/19/26 2:38 PM EST","HubSpot Calculation"
"Latest Disqualified Lead Date","hs_latest_disqualified_lead_date","datetime","The most recent time at which an associated lead currently in a disqualified stage was moved to that stage","contactinformation","false","","true","true","true","false","false","true","HubSpot","","0%","",""
"Latest Open Lead Date","hs_latest_open_lead_date","datetime","The most recent time an associated open lead was moved to a NEW or IN_PROGRESS state","contactinformation","false","","true","true","true","false","false","true","HubSpot","","0%","",""
"Latest Qualified Lead Date","hs_latest_qualified_lead_date","datetime","The most recent time at which an associated lead currently in a qualified stage was moved to that stage","contactinformation","false","","true","true","true","false","false","true","HubSpot","","0%","",""
"Last sequence ended date","hs_latest_sequence_ended_date","datetime","The last sequence ended date.","contactinformation","false","","true","true","true","false","false","true","HubSpot","","0%","",""
"Last sequence enrolled","hs_latest_sequence_enrolled","number","The last sequence enrolled.","contactinformation","false","","true","true","false","true","false","true","HubSpot","","0%","",""
"Last sequence enrolled date","hs_latest_sequence_enrolled_date","datetime","The last sequence enrolled date.","contactinformation","false","","true","true","false","false","false","true","HubSpot","","0%","",""
"Lead Status","hs_lead_status","enumeration","The contact's sales, prospecting or outreach status","contactinformation","true","Unclassified; Vendor; New - Manual; New (NEW); Prospecting; In Progress (IN_PROGRESS); Bad Timing (BAD_TIMING); Unqualified (UNQUALIFIED); Disco Booked; Disco Incomplete; Demo Booked; Demo Incomplete; Closing Call Booked; Closing Call Incomplete; Closing Call Complete - Nurture; F/U Booked; F/U Incomplete; Red Zone; Closed Won; Closed Lost; Bad Data; Do Not Contact","false","true","false","false","false","true","HubSpot","Inbounddb lists (1)","0.93%","2/19/26 2:38 PM EST","CRM UI"
"Legal basis for processing contact's data","hs_legal_basis","enumeration","Legal basis for processing contact's data; 'Not applicable' will exempt the contact from GDPR protections","contactinformation","false","Legitimate interest - prospect/lead (Legitimate interest – prospect/lead) [READ-ONLY]; Legitimate interest - existing customer (Legitimate interest – existing customer) [READ-ONLY]; Legitimate interest - other [READ-ONLY]; Performance of a contract [READ-ONLY]; Freely given consent from contact [READ-ONLY]; Not applicable [READ-ONLY]","false","true","false","false","false","true","HubSpot","","0%","",""
"Marketing contact status","hs_marketable_status","enumeration","The marketing status of a contact","contactinformation","false","Marketing contact (true); Non-marketing contact (false)","true","true","false","false","false","true","HubSpot","Inbounddb lists (4)","100%","2/19/26 2:38 PM EST","CRM UI"
"Membership last private content access date","hs_membership_last_private_content_access_date","datetime","The last date a contact accessed private content","contactinformation","false","","true","true","false","false","false","true","HubSpot","","0%","",""
"Record ID","hs_object_id","number","The unique ID for this record. This value is set automatically by HubSpot.","contactinformation","false","","true","true","false","false","false","true","HubSpot","Flow action (1); Email (1)","100%","2/19/26 2:38 PM EST","CRM UI"
"Record source detail 2","hs_object_source_detail_2","string","Second level of detail on how this record was created.","contactinformation","false","","true","true","false","false","false","true","HubSpot","","0%","",""
