"Name","Internal name","Type","Description","Group name","Form field","Options","Read only value","Read only definition","Calculated","External options","Deleted","HubSpot defined","Created user","Usages","Fill rate","Last Updated Time","Update Source"
"Date exited ""Not Classified (Lifecycle Stage Pipeline)""","hs_v2_date_exited_other","datetime","The date and time when the contact exited the 'Not Classified' stage, 'Lifecycle Stage Pipeline' pipeline","contactlcs","false","","true","true","false","false","false","true","HubSpot","","29.65%","2/15/26 5:32 PM EST","HubSpot Calculation"
"Date exited ""Vendor (Lifecycle Stage Pipeline)""","hs_v2_date_exited_salesqualifiedlead","datetime","The date and time when the contact exited the 'Vendor' stage, 'Lifecycle Stage Pipeline' pipeline","contactlcs","false","","true","true","false","false","false","true","HubSpot","","0.29%","",""
"Date exited ""Subscriber (Lifecycle Stage Pipeline)""","hs_v2_date_exited_subscriber","datetime","The date and time when the contact exited the 'Subscriber' stage, 'Lifecycle Stage Pipeline' pipeline","contactlcs","false","","true","true","false","false","false","true","HubSpot","","1.43%","7/20/25 4:10 PM EDT","HubSpot Calculation"
"Latest time in ""Ex-Customer - Closed (Lifecycle Stage Pipeline)""","hs_v2_latest_time_in_1213817381","number","The total time in seconds spent by the contact in the 'Ex-Customer - Closed' stage, 'Lifecycle Stage Pipeline' pipeline since it last entered this stage","contactlcs","false","","true","true","false","false","false","true","HubSpot","","0%","",""
"Latest time in ""Non-Customer - Closed (Lifecycle Stage Pipeline)""","hs_v2_latest_time_in_1281727614","number","The total time in seconds spent by the contact in the 'Non-Customer - Closed' stage, 'Lifecycle Stage Pipeline' pipeline since it last entered this stage","contactlcs","false","","true","true","false","false","false","true","HubSpot","","0%","",""
"Latest time in ""Ex-Customer - Switched (Lifecycle Stage Pipeline)""","hs_v2_latest_time_in_50772225","number","The total time in seconds spent by the contact in the 'Ex-Customer - Switched' stage, 'Lifecycle Stage Pipeline' pipeline since it last entered this stage","contactlcs","false","","true","true","false","false","false","true","HubSpot","","0%","",""
"Latest time in ""Customer - Onboarding (Lifecycle Stage Pipeline)""","hs_v2_latest_time_in_50772226","number","The total time in seconds spent by the contact in the 'Customer - Onboarding' stage, 'Lifecycle Stage Pipeline' pipeline since it last entered this stage","contactlcs","false","","true","true","false","false","false","true","HubSpot","","6.1%","2/19/26 1:05 PM EST","HubSpot Calculation"
"Latest time in ""Alpha Team Member (Lifecycle Stage Pipeline)""","hs_v2_latest_time_in_50954637","number","The total time in seconds spent by the contact in the 'Alpha Team Member' stage, 'Lifecycle Stage Pipeline' pipeline since it last entered this stage","contactlcs","false","","true","true","false","false","false","true","HubSpot","","0%","",""
"Latest time in ""Customer (Lifecycle Stage Pipeline)""","hs_v2_latest_time_in_979767826","number","The total time in seconds spent by the contact in the 'Customer' stage, 'Lifecycle Stage Pipeline' pipeline since it last entered this stage","contactlcs","false","","true","true","false","false","false","true","HubSpot","","0.84%","11/12/25 4:45 PM EST","HubSpot Calculation"
"Latest time in ""Declass (Lifecycle Stage Pipeline)""","hs_v2_latest_time_in_979801500","number","The total time in seconds spent by the contact in the 'Declass' stage, 'Lifecycle Stage Pipeline' pipeline since it last entered this stage","contactlcs","false","","true","true","false","false","false","true","HubSpot","","0%","",""
"Latest time in ""Customer - Support (Lifecycle Stage Pipeline)""","hs_v2_latest_time_in_customer","number","The total time in seconds spent by the contact in the 'Customer - Support' stage, 'Lifecycle Stage Pipeline' pipeline since it last entered this stage","contactlcs","false","","true","true","false","false","false","true","HubSpot","","4.97%","2/6/26 12:35 PM EST","HubSpot Calculation"
"Latest time in ""Evangelist (Lifecycle Stage Pipeline)""","hs_v2_latest_time_in_evangelist","number","The total time in seconds spent by the contact in the 'Evangelist' stage, 'Lifecycle Stage Pipeline' pipeline since it last entered this stage","contactlcs","false","","true","true","false","false","false","true","HubSpot","","0%","",""
"Latest time in ""Prospect (Lifecycle Stage Pipeline)""","hs_v2_latest_time_in_lead","number","The total time in seconds spent by the contact in the 'Prospect' stage, 'Lifecycle Stage Pipeline' pipeline since it last entered this stage","contactlcs","false","","true","true","false","false","false","true","HubSpot","","34.51%","2/19/26 2:38 PM EST","HubSpot Calculation"
"Latest time in ""Partner (Lifecycle Stage Pipeline)""","hs_v2_latest_time_in_marketingqualifiedlead","number","The total time in seconds spent by the contact in the 'Partner' stage, 'Lifecycle Stage Pipeline' pipeline since it last entered this stage","contactlcs","false","","true","true","false","false","false","true","HubSpot","","0.44%","2/6/26 12:35 PM EST","HubSpot Calculation"
"Latest time in ""Opportunity (Lifecycle Stage Pipeline)""","hs_v2_latest_time_in_opportunity","number","The total time in seconds spent by the contact in the 'Opportunity' stage, 'Lifecycle Stage Pipeline' pipeline since it last entered this stage","contactlcs","false","","true","true","false","false","false","true","HubSpot","","8.7%","2/3/26 5:25 PM EST","HubSpot Calculation"
"Latest time in ""Not Classified (Lifecycle Stage Pipeline)""","hs_v2_latest_time_in_other","number","The total time in seconds spent by the contact in the 'Not Classified' stage, 'Lifecycle Stage Pipeline' pipeline since it last entered this stage","contactlcs","false","","true","true","false","false","false","true","HubSpot","","29.65%","2/15/26 5:32 PM EST","HubSpot Calculation"
"Latest time in ""Vendor (Lifecycle Stage Pipeline)""","hs_v2_latest_time_in_salesqualifiedlead","number","The total time in seconds spent by the contact in the 'Vendor' stage, 'Lifecycle Stage Pipeline' pipeline since it last entered this stage","contactlcs","false","","true","true","false","false","false","true","HubSpot","","0.29%","",""
"Latest time in ""Subscriber (Lifecycle Stage Pipeline)""","hs_v2_latest_time_in_subscriber","number","The total time in seconds spent by the contact in the 'Subscriber' stage, 'Lifecycle Stage Pipeline' pipeline since it last entered this stage","contactlcs","false","","true","true","false","false","false","true","HubSpot","","1.43%","7/20/25 4:10 PM EDT","HubSpot Calculation"
"Time in current stage","hs_v2_time_in_current_stage","datetime","The time this object has spent in the current pipeline stage","contactlcs","false","","true","true","true","false","false","true","HubSpot","","100%","2/19/26 2:38 PM EST","HubSpot Calculation"
"Member has accessed private content","hs_membership_has_accessed_private_content","number","1 if a member has accessed any private content, 0 or null if not","contactscripted","false","","true","true","true","false","false","true","HubSpot","","100%","2/19/26 2:38 PM EST","HubSpot Calculation"
"Registered member","hs_registered_member","number","Whether or not a contact is registered","contactscripted","false","","true","true","true","false","false","true","HubSpot","","100%","2/19/26 2:38 PM EST","HubSpot Calculation"
"First Conversion Date","first_conversion_date","datetime","The date this contact first submitted a form","conversioninformation","false","","true","true","true","false","false","true","HubSpot","","0%","",""
"First Conversion","first_conversion_event_name","string","The first form this contact submitted","conversioninformation","false","","true","true","true","false","false","true","HubSpot","","0%","",""
"Facebook click id","hs_facebook_click_id","string","","conversioninformation","false","","false","true","false","false","false","true","HubSpot","","0.05%","",""
"Google ad click id","hs_google_click_id","string","","conversioninformation","false","","false","true","false","false","false","true","HubSpot","","0%","",""
"IP Timezone","hs_ip_timezone","string","The timezone reported by a contact's IP address. This is automatically set by HubSpot and can be used for segmentation and reporting.","conversioninformation","false","","true","true","false","false","false","true","HubSpot","","3.83%","2/16/26 4:49 PM EST","IP Address Location"
"LinkedIn click id","hs_linkedin_click_id","string","The li_fat_id url parameter extracted from the Activity recorded when a visitor lands on a tracked webpage","conversioninformation","false","","false","true","false","false","false","true","HubSpot","","0%","",""
"IP City","ip_city","string","The city reported by a contact's IP address. This is automatically set by HubSpot and can be used for segmentation and reporting.","conversioninformation","false","","true","true","false","false","false","true","HubSpot","","3.15%","2/19/26 10:00 AM EST","IP Address Location"
"IP Country","ip_country","string","The country reported by a contact's IP address. This is automatically set by HubSpot and can be used for segmentation and reporting.","conversioninformation","false","","true","true","false","false","false","true","HubSpot","","3.83%","2/16/26 4:49 PM EST","IP Address Location"
"IP Country Code","ip_country_code","string","The country code reported by a contact's IP address. This is automatically set by HubSpot and can be used for segmentation and reporting.","conversioninformation","false","","true","true","false","false","false","true","HubSpot","","3.83%","2/16/26 4:49 PM EST","IP Address Location"
"IP State/Region","ip_state","string","The state or region reported by a contact's IP address. This is automatically set by HubSpot and can be used for segmentation and reporting.","conversioninformation","false","","true","true","false","false","false","true","HubSpot","","3.83%","2/16/26 4:49 PM EST","IP Address Location"
"IP State Code/Region Code","ip_state_code","string","The state code or region code reported by a contact's IP address. This is automatically set by HubSpot and can be used for segmentation and reporting.","conversioninformation","false","","true","true","false","false","false","true","HubSpot","","3.83%","2/16/26 4:49 PM EST","IP Address Location"
"Number of Form Submissions","num_conversion_events","number","The number of forms this contact has submitted","conversioninformation","false","","true","true","true","false","false","true","HubSpot","","100%","2/19/26 2:38 PM EST","HubSpot Calculation"
"Number of Unique Forms Submitted","num_unique_conversion_events","number","The number of different forms this contact has submitted","conversioninformation","false","","true","true","true","false","false","true","HubSpot","","100%","2/19/26 2:38 PM EST","HubSpot Calculation"
"Recent Conversion Date","recent_conversion_date","datetime","The date this contact last submitted a form","conversioninformation","false","","true","true","true","false","false","true","HubSpot","","0%","",""
"Recent Conversion","recent_conversion_event_name","string","The last form this contact submitted","conversioninformation","false","","true","true","true","false","false","true","HubSpot","","0%","",""
"Currently in workflow (discontinued)","currentlyinworkflow","enumeration","If the contact is currently enrolled in any workflow","emailinformation","false","True (true); False (false)","true","true","false","false","false","true","HubSpot","","38.35%","4/24/25 9:45 PM EDT","Workflow"
"Invalid email address","hs_email_bad_address","bool","The email address associated with this contact is invalid.","emailinformation","false","True (true); False (false)","true","true","false","false","false","true","HubSpot","","0%","",""
"Marketing emails bounced","hs_email_bounce","number","The number of marketing emails that bounced for the current email address. This is automatically set by HubSpot.","emailinformation","false","","true","true","false","false","false","true","HubSpot","","0.2%","9/19/25 2:47 PM EDT","Email Activity"
"Marketing emails clicked","hs_email_click","number","The number of marketing emails which have had link clicks for the current email address. This is automatically set by HubSpot.","emailinformation","false","","true","true","false","false","false","true","HubSpot","","1.33%","2/4/26 12:49 AM EST","Email Activity"
"Email address quarantine reason","hs_email_customer_quarantined_reason","enumeration","The reason why the email address has been quarantined.","emailinformation","false","Suspension Remediation (SUSPENSION_REMEDIATION) [READ-ONLY]; Blocklist Remediation (BLOCKLIST_REMEDIATION) [READ-ONLY]; Trust & Safety Remediation (TRUST_SAFETY_REMEDIATION) [READ-ONLY]","false","true","false","false","false","true","HubSpot","","0%","",""
"Marketing emails delivered","hs_email_delivered","number","The number of marketing emails delivered for the current email address. This is automatically set by HubSpot.","emailinformation","false","","true","true","false","false","false","true","HubSpot","","6.74%","2/19/26 11:33 AM EST","Email Activity"
"First marketing email click date","hs_email_first_click_date","datetime","The date of the earliest link click for any marketing email to the current email address. This is automatically set by HubSpot.","emailinformation","false","","true","true","false","false","false","true","HubSpot","","1.33%","2/4/26 12:49 AM EST","Email Activity"
"First marketing email open date","hs_email_first_open_date","datetime","The date of the earliest open for any marketing email to the current email address. This is automatically set by HubSpot.","emailinformation","false","","true","true","false","false","false","true","HubSpot","","3.49%","2/19/26 12:49 PM EST","Email Activity"
"First marketing email reply date","hs_email_first_reply_date","datetime","The date of the earliest reply for any marketing email to the current email address. This is automatically set by HubSpot.","emailinformation","false","","true","true","false","false","false","true","HubSpot","","0.1%","12/19/25 4:42 PM EST","Email Activity"
"First marketing email send date","hs_email_first_send_date","datetime","The date of the earliest delivery for any marketing email to the current email address. This is automatically set by HubSpot.","emailinformation","false","","true","true","false","false","false","true","HubSpot","","5.46%","2/19/26 11:33 AM EST","Email Activity"
"Email hard bounce reason","hs_email_hard_bounce_reason_enum","enumeration","The issue that caused a contact to hard bounce from your emails. If this is an error or a temporary issue, you can unbounce this contact from the contact record.","emailinformation","false","Content (CONTENT) [READ-ONLY]; Mailbox full (MAILBOX_FULL) [READ-ONLY]; Other (OTHER) [READ-ONLY]; Policy (POLICY) [READ-ONLY]; Spam (SPAM) [READ-ONLY]; Unknown user (UNKNOWN_USER) [READ-ONLY]","true","true","false","false","false","true","HubSpot","","1.52%","2/17/26 10:47 AM EST","Email Activity"
"Last marketing email click date","hs_email_last_click_date","datetime","The date of the most recent link click for any marketing email to the current email address. This is automatically set by HubSpot.","emailinformation","false","","true","true","false","false","false","true","HubSpot","","1.33%","2/4/26 12:49 AM EST","Email Activity"
"Last marketing email name","hs_email_last_email_name","string","The name of the last marketing email sent to the current email address. This is automatically set by HubSpot.","emailinformation","false","","true","true","false","false","false","true","HubSpot","","6.88%","2/19/26 11:33 AM EST","Email Activity"
"Last marketing email open date","hs_email_last_open_date","datetime","The date of the most recent open for any marketing email to the current email address. This is automatically set by HubSpot.","emailinformation","false","","true","true","false","false","false","true","HubSpot","","3.74%","2/19/26 12:49 PM EST","Email Activity"
"Last marketing email reply date","hs_email_last_reply_date","datetime","The date of the latest reply for any marketing email to the current email address. This is automatically set by HubSpot.","emailinformation","false","","true","true","false","false","false","true","HubSpot","","0.1%","12/19/25 4:42 PM EST","Email Activity"
"Last marketing email send date","hs_email_last_send_date","datetime","The date of the most recent delivery for any marketing email to the current email address. This is automatically set by HubSpot.","emailinformation","false","","true","true","false","false","false","true","HubSpot","","6.74%","2/19/26 11:33 AM EST","Email Activity"
"Marketing emails opened","hs_email_open","number","The number of marketing emails opened for the current email address. This is automatically set by HubSpot.","emailinformation","false","","true","true","false","false","false","true","HubSpot","","3.74%","2/19/26 12:50 PM EST","Email Activity"
"Unsubscribed from all email","hs_email_optout","bool","Indicates that the current email address has opted out of all email.","emailinformation","false","True (true); False (false)","true","true","false","false","false","true","HubSpot","","0.15%","2/2/26 9:18 PM EST","Email Activity"
"Opted out of email: Marketing Information","hs_email_optout_2149816458","enumeration","Indicates that the current email address has opted out of this email type.","emailinformation","false","Yes (true); No (false)","true","true","false","false","false","true","HubSpot","","0%","",""
"Opted out of email: One to One","hs_email_optout_2149816461","enumeration","Indicates that the current email address has opted out of this email type.","emailinformation","false","Yes (true); No (false)","true","true","false","false","false","true","HubSpot","","0%","",""
"Email Address Quarantined","hs_email_quarantined","bool","Indicates that the current email address has been quarantined for anti-abuse reasons and any marketing email sends to it will be blocked. This is automatically set by HubSpot.","emailinformation","false","True (true); False (false)","true","true","false","false","false","true","HubSpot","","0%","",""
"Email address automated quarantine reason","hs_email_quarantined_reason","enumeration","The automated reason why the email address has been quarantined.","emailinformation","false","Suspicious List Import (ON_LIST_IMPORT) [READ-ONLY]; High Hard Bounce Rate (HIGH_HARD_BOUNCE_RATE) [READ-ONLY]; Multiple Cancelled Campaigns (MULTIPLE_CANCELLED_CAMPAIGNS) [READ-ONLY]; Suspicious Form Activity (FORM_ABUSE) [READ-ONLY]; Recipient Complaint (RECIPIENT_COMPLAINT) [READ-ONLY]; Suspension Remediation (SUSPENSION_REMEDIATION) [READ-ONLY]; Blocklist Remediation (BLOCKLIST_REMEDIATION) [READ-ONLY]; Trust & Safety Remediation (TRUST_SAFETY_REMEDIATION) [READ-ONLY]; Other (OTHER) [READ-ONLY]; Undeliverable Email Address (UNDELIVERABLE_ADDRESS) [READ-ONLY]; Microsoft Undeliverable - Microsoft reports that address is inactive (MICROSOFT_UNDELIVERABLE)","true","true","false","false","false","true","HubSpot","","0%","",""
"Marketing emails replied","hs_email_replied","number","The number of marketing emails replied to by the current email address. This is automatically set by HubSpot.","emailinformation","false","","true","true","false","false","false","true","HubSpot","","0.1%","12/19/25 4:42 PM EST","Email Activity"
"Sends Since Last Engagement","hs_email_sends_since_last_engagement","number","The number of marketing emails that have been sent to the current email address since the last engagement (open or link click). This is automatically set by HubSpot.","emailinformation","false","","true","true","false","false","false","true","HubSpot","","6.29%","2/19/26 12:49 PM EST","Email Activity"
"Marketing email confirmation status","hs_emailconfirmationstatus","enumeration","The status of a contact's eligibility to receive marketing email. This is automatically set by HubSpot.","emailinformation","false","Confirmed; Confirmation Pending; Confirmation Email Sent; User clicked confirmation; HubSpot Rep. marked confirmed; Customer marked confirmed; Confirmed from previous behavior; Confirmed due to form","true","true","false","false","false","true","HubSpot","","0%","",""
"Enriched Email Bounce Detected (Deprecated)","hs_enriched_email_bounce_detected","bool","Bounce Detected attribute is no longer being populated/updated after 10/31/2025. In order to receive signals about an email address becoming undeliverable or no longer valid for the contact, please use Intent Signals.","emailinformation","false","Yes (true); No (false)","false","true","false","false","false","true","HubSpot","","0%","",""
"Quarantined Emails","hs_quarantined_emails","string","Lists all emails associated with this contact that have been quarantined, with a source and reason.","emailinformation","false","","true","true","false","false","false","true","HubSpot","","0%","",""
"Need a Reliable Point of Sale System?","need_a_reliable_point_of_sale_system","string","Lead Ad Properties","lead_ads","true","","false","false","false","false","false","false","Lucas Graham","","0%","",""
"Restaurant Type","restaurant_type","string","Lead Ad Properties","lead_ads","true","","false","false","false","false","false","false","Lucas Graham","","0%","",""
"What type of Restaurant Are You?","what_type_of_restaurant_are_you","string","Lead Ad Properties","lead_ads","true","","false","false","false","false","false","false","Lucas Graham","","0%","",""
"Would you like to schedule a Free Demo?","would_you_like_to_schedule_a_free_demo","string","Lead Ad Properties","lead_ads","true","","false","false","false","false","false","false","Lucas Graham","","0%","",""
"First Closed Order ID","hs_first_closed_order_id","number","The id of the associated order that was first to be closed","order_information","false","","true","true","false","false","false","true","HubSpot","","0%","",""
"First Order Closed Date","hs_first_order_closed_date","datetime","Date first order was closed. Set Automatically","order_information","false","","true","true","false","false","false","true","HubSpot","","0%","",""
"Recent Closed Order Date","hs_recent_closed_order_date","datetime","Date last order was closed. Set automatically.","order_information","false","","true","true","false","false","false","true","HubSpot","","0%","",""
"Project Tracking Link","project_tracking_link","string","","projecttracker","false","","false","false","false","false","false","false","Lucas Graham","","0%","",""
"Canceled Meeting","canceled_meeting","enumeration","","sales_momentum","true","Yes; No","false","false","false","false","false","false","Lucas Graham","","0.05%","3/28/25 12:46 PM EDT","Workflow"
"Closer Owner","closer_owner","enumeration","This property identifies who is assigned to this lead by who out of the closing team is the owner of this lead.","sales_momentum","false","","false","false","false","true","false","false","Lucas Graham","Automation platform flow (1)","0.39%","10/29/25 8:44 PM EDT","Workflow"
"Closing Call Outcome","closing_call_outcome","enumeration","","sales_momentum","true","Scheduled; Completed; Rescheduled; No Show; Canceled","false","false","false","false","false","false","Lucas Graham","","0.34%","7/20/25 4:07 PM EDT","Workflow"
"Contact Owner's MQL No Book Link","contact_owner_s_mql_no_book_link","string","","sales_momentum","true","","false","false","false","false","false","false","Lucas Graham","","0.54%","7/23/25 12:59 PM EDT","Workflow"
"Demo Call Incomplete Date","disco_call_incomplete","date","","sales_momentum","true","","false","false","false","false","false","false","Lucas Graham","","0%","",""
"Demo Call Outcome","disco_call_outcome","enumeration","","sales_momentum","true","Scheduled; Completed; Rescheduled; No Show; Canceled","false","false","false","false","false","false","Lucas Graham","","0.1%","4/1/25 7:05 PM EDT","Workflow"
"Discovery Call Incomplete Date","discovery_call_incomplete_date","date","","sales_momentum","true","","false","false","false","false","false","false","Lucas Graham","","0%","",""
"Discovery Call Outcome","discovery_call_outcome","enumeration","","sales_momentum","true","Scheduled; Completed; Rescheduled; No Show; Canceled","false","false","false","false","false","false","Lucas Graham","","0.05%","3/28/25 12:32 PM EDT","Workflow"
"Email - Needs Response","email___needs_response","enumeration","","sales_momentum","true","Yes (true); No (false)","false","false","false","false","false","false","Lucas Graham","","0.05%","7/22/25 3:34 PM EDT","Workflow"
"Last Closing Call Booked","last_closing_call_booked","date","The Date of the last booked closing call.","sales_momentum","true","","false","false","false","false","false","false","Lucas Graham","","0%","",""
"Last Demo Call Booked","last_disco_call_booked","date","The Date of the last booked discovery call.","sales_momentum","true","","false","false","false","false","false","false","Lucas Graham","","0.05%","3/31/25 10:56 AM EDT","Workflow"
"Last Disco Call Booked","last_discocall_booked","date","The Date of the last booked discovery call.","sales_momentum","true","","false","false","false","false","false","false","Lucas Graham","","0.05%","3/28/25 12:32 PM EDT","Workflow"
"Latest Meeting Start Time","latest_meeting_start_time","string","","sales_momentum","true","","false","false","false","false","false","false","Lucas Graham","","0.05%","3/28/25 12:47 PM EDT","Integration"
"Latest meeting Google Meet link","latest_meeting_zoom_link","string","","sales_momentum","false","","false","false","false","false","false","false","Lucas Graham","","0.05%","3/28/25 12:47 PM EDT","Workflow"
